{
  "exam": "CPA_1",
  "subject": "tax",
  "unit": "national_tax_basic_act",
  "applicable_year": 2026,
  "stem": "국세기본법상 국세부과의 원칙에 해당하지 않는 것은?",
  "choices": [
    "실질과세의 원칙",
    "신의성실의 원칙",
    "근거과세의 원칙",
    "조세감면의 사후관리",
    "납세자권리헌장의 교부"
  ],
  "correct_choice": 4,
  "explanation": "국세기본법 제14조~제18조에 규정된 국세부과의 원칙은 ① 실질과세의 원칙(제14조), ② 신의성실의 원칙(제15조), ③ 근거과세의 원칙(제16조), ④ 조세감면의 사후관리(제17조)이다. '납세자권리헌장의 교부'는 국세부과의 원칙이 아니라 국세기본법상 납세자의 권리(제81조의2)와 관련된 절차적 규정이다. 따라서 정답은 5번이다.",
  "concept_tags": [
    "국세부과의 원칙",
    "실질과세",
    "근거과세",
    "신의성실",
    "조세감면 사후관리"
  ],
  "expected_seconds": 60,
  "difficulty": "easy",
  "difficulty_score": 2,
  "bloom_level": "remember",
  "rights_status": "synthetic_seed",
  "review_status": "ai_draft_verified",
  "attractor_traps": [
    "납세자권리헌장의 교부는 국세부과의 원칙(제14~18조)이 아닌 납세자권리(제81조의2) 규정이라는 점을 혼동",
    "조세감면의 사후관리(제17조)는 국세부과의 원칙에 포함되지만 명칭이 생소하여 정답으로 오인할 가능성"
  ],
  "question_id": "cpa1-eval-tax-010"
}