{
  "exam": "CPA_1",
  "subject": "accounting",
  "unit": "intangible_assets",
  "applicable_year": 2026,
  "stem": "K-IFRS 제1038호 '무형자산'에 관한 다음 설명 중 옳지 않은 것은?",
  "choices": [
    "어떤 항목이 식별가능성, 자원에 대한 통제, 미래 경제적효익의 존재라는 무형자산의 정의를 충족하면 별도의 인식기준을 검토할 필요 없이 무형자산으로 인식한다.",
    "내부적으로 창출한 영업권은 원가를 신뢰성 있게 측정할 수 없으므로 무형자산으로 인식하지 아니한다.",
    "연구(또는 내부 프로젝트의 연구단계)에서 발생한 지출은 발생시점에 비용으로 인식한다.",
    "내용연수가 비한정인 무형자산은 상각하지 아니하나, 매 보고기간 말에 상각하지 않는 것이 적절한지 재검토하고 손상검사를 수행한다.",
    "무형자산의 잔존가치는 일반적으로 영(0)으로 보되, 제3자가 내용연수 종료시점에 해당 자산을 구입하기로 약정한 경우 등 일정한 요건을 충족하면 영(0)이 아닌 금액으로 추정할 수 있다."
  ],
  "correct_choice": 0,
  "explanation": "K-IFRS 제1038호 문단 10·11·18·21에 따르면, 무형자산의 '정의'는 식별가능성·통제·미래 경제적효익의 세 요소로 구성되지만, 이를 자산으로 '인식'하기 위해서는 정의 충족에 더하여 ① 미래 경제적효익의 유입 가능성이 높고 ② 원가를 신뢰성 있게 측정할 수 있어야 한다는 인식기준을 추가로 충족해야 한다. 따라서 정의 충족만으로 인식할 수 있다는 ①은 옳지 않다. ② 문단 48~49(내부창출 영업권은 원가의 신뢰성 있는 측정 불가), ③ 문단 54(연구단계 지출은 발생시점 비용), ④ 문단 107·108(비한정 내용연수 자산의 비상각·매년 손상검사 및 비한정 평가 재검토), ⑤ 문단 100(잔존가치 원칙 0, 예외 요건)은 모두 옳은 진술이다.",
  "concept_tags": [
    "무형자산",
    "정의와 인식기준",
    "내부창출 영업권",
    "연구단계 지출",
    "내용연수 비한정"
  ],
  "expected_seconds": 90,
  "difficulty": "easy",
  "difficulty_score": 2,
  "bloom_level": "understand",
  "rights_status": "synthetic_seed",
  "review_status": "ai_draft_revised",
  "attractor_traps": [
    "②: 내부창출 영업권의 인식 불가 사유를 '식별불가'로 혼동시키는 함정 (실제는 원가 신뢰성 측정 불가)",
    "③: '항상'이라는 단정적 표현으로 예외가 있다고 오인하게 만드는 함정",
    "④: 비한정 내용연수 자산도 상각해야 한다고 오인하게 만드는 함정",
    "⑤: 잔존가치가 항상 0이라고 오인하게 만드는 함정"
  ],
  "question_id": "cpa1-eval-accounting-023"
}