{
  "exam": "CPA_1",
  "subject": "accounting",
  "unit": "cash_flow",
  "applicable_year": 2026,
  "stem": "(주)대한은 20x6년도 현금흐름표를 간접법으로 작성하고 있다. 다음 자료를 이용하여 영업활동현금흐름을 계산하면 얼마인가?\n\n• 당기순이익: ₩500,000\n• 감가상각비: ₩80,000\n• 유형자산처분이익: ₩30,000\n• 사채상환손실: ₩20,000\n• 매출채권 증가: ₩60,000\n• 재고자산 감소: ₩40,000\n• 매입채무 감소: ₩25,000\n• 미지급이자 증가: ₩15,000\n• 법인세비용은 손익계산서에 포함되어 있으며, 이자지급 및 법인세납부는 영업활동으로 분류한다.",
  "choices": [
    "₩510,000",
    "₩540,000",
    "₩560,000",
    "₩600,000",
    "₩620,000"
  ],
  "correct_choice": 1,
  "explanation": "간접법에 의한 영업활동현금흐름 계산:\n당기순이익 500,000\n(+) 감가상각비 80,000 (비현금비용 가산)\n(-) 유형자산처분이익 30,000 (투자활동 관련, 차감)\n(+) 사채상환손실 20,000 (재무활동 관련, 가산)\n(-) 매출채권 증가 60,000\n(+) 재고자산 감소 40,000\n(-) 매입채무 감소 25,000\n(+) 미지급이자 증가 15,000\n= 500,000 + 80,000 - 30,000 + 20,000 - 60,000 + 40,000 - 25,000 + 15,000 = ₩540,000\n\nK-IFRS 제1007호에 따라 비현금항목과 영업활동과 무관한 손익(투자·재무활동 관련 손익)을 조정하고, 영업관련 자산·부채의 증감을 반영한다. 매력적 오답: ① 사채상환손실을 가산하지 않은 경우(520,000 유사), ③ 처분이익을 가산하거나 부호를 혼동한 경우, ④⑤ 자산·부채 증감 부호를 바꾼 경우.",
  "concept_tags": [
    "현금흐름표",
    "간접법",
    "영업활동현금흐름",
    "비현금항목조정",
    "운전자본증감"
  ],
  "expected_seconds": 150,
  "difficulty": "mid",
  "difficulty_score": 3,
  "bloom_level": "apply",
  "rights_status": "synthetic_seed",
  "review_status": "ai_draft_verified",
  "attractor_traps": [
    "① 510,000: 사채상환손실(20,000) 가산을 누락하고 미지급이자 증가만 일부 반영한 혼동",
    "③ 560,000: 유형자산처분이익을 차감하지 않고 가산한 부호 오류 (또는 사채상환손실 부호 혼동)",
    "④ 600,000: 매출채권 증가/매입채무 감소의 부호를 반대로 처리",
    "⑤ 620,000: 영업관련 자산·부채 증감 전반의 부호 혼동"
  ],
  "question_id": "cpa1-eval-accounting-044"
}