{
  "exam": "CPA_1",
  "subject": "tax",
  "unit": "vat",
  "applicable_year": 2026,
  "stem": "다음 중 부가가치세법상 면세 대상 재화 또는 용역에 해당하지 않는 것은?",
  "choices": [
    "미가공 식료품(국내산 및 외국산 농·축·수·임산물)",
    "수돗물",
    "시내버스 여객운송용역",
    "고속철도(KTX)에 의한 여객운송용역",
    "의료보건용역(의사가 제공하는 진료용역)"
  ],
  "correct_choice": 3,
  "explanation": "부가가치세법 제26조(면세) 규정에 따라 미가공식료품, 수돗물, 시내버스 등 대중교통 여객운송용역, 의료보건용역은 면세대상이다. 그러나 항공기·고속버스·전세버스·택시·특수자동차·특종선박 또는 고속철도(KTX)에 의한 여객운송용역은 면세에서 제외되어 과세대상이다(부가가치세법 시행령 제37조). 따라서 KTX 여객운송용역은 면세대상이 아니다.",
  "concept_tags": [
    "부가가치세",
    "면세",
    "여객운송용역",
    "KTX",
    "면세범위"
  ],
  "expected_seconds": 60,
  "difficulty": "easy",
  "difficulty_score": 2,
  "bloom_level": "remember",
  "rights_status": "synthetic_seed",
  "review_status": "ai_draft_verified",
  "attractor_traps": [
    "미가공 식료품: 외국산 농산물도 면세인지 헷갈리게 함 (외국산도 미가공이면 면세)",
    "시내버스와 KTX 모두 여객운송이라는 점에서 혼동 유발",
    "의료보건용역의 면세 범위에 대한 일반적 혼동"
  ],
  "question_id": "cpa1-eval-tax-021"
}