{
  "exam": "CPA_1",
  "subject": "accounting",
  "unit": "financial_assets",
  "applicable_year": 2026,
  "stem": "(주)대한은 20x1년 1월 1일에 액면금액 ₩1,000,000, 표시이자율 연 8%(매년 말 후급), 만기 3년인 사채를 ₩950,244에 취득하고 'AC(상각후원가측정금융자산)'로 분류하였다. 취득 시 유효이자율은 연 10%이다. 20x1년 말 동 금융자산의 장부금액과 20x1년도 이자수익은 각각 얼마인가? (단, 손상은 고려하지 않으며, 단수차이는 무시한다.)",
  "choices": [
    "장부금액 ₩965,268, 이자수익 ₩95,024",
    "장부금액 ₩965,268, 이자수익 ₩80,000",
    "장부금액 ₩950,244, 이자수익 ₩95,024",
    "장부금액 ₩975,024, 이자수익 ₩76,020"
  ],
  "correct_choice": 0,
  "explanation": "1) 유효이자율법에 따른 이자수익 = 기초 장부금액 × 유효이자율 = ₩950,244 × 10% = ₩95,024.\n2) 현금이자 수령액 = ₩1,000,000 × 8% = ₩80,000.\n3) 상각액 = ₩95,024 - ₩80,000 = ₩15,024.\n4) 20x1년 말 장부금액 = ₩950,244 + ₩15,024 = ₩965,268.\n근거: K-IFRS 1109호 문단 4.1.2 및 부록 A(유효이자율법). 매력적 오답: ②는 표시이자율로 이자수익을 계산한 오류, ③은 상각을 누락한 오류, ④는 할증발행으로 오인한 오류이다.",
  "concept_tags": [
    "상각후원가측정금융자산",
    "유효이자율법",
    "사채투자",
    "이자수익",
    "K-IFRS 1109"
  ],
  "expected_seconds": 150,
  "difficulty": "mid",
  "difficulty_score": 3,
  "bloom_level": "apply",
  "rights_status": "synthetic_seed",
  "review_status": "ai_draft_verified",
  "attractor_traps": [
    "②: 유효이자율 대신 표시이자율로 이자수익 계산",
    "③: 상각을 누락하여 취득원가를 그대로 장부금액으로 인식",
    "④: 할증취득으로 오인하여 상각방향을 반대로 적용"
  ],
  "question_id": "cpa1-eval-accounting-014"
}