{
  "exam": "CPA_1",
  "subject": "tax",
  "unit": "income_tax",
  "applicable_year": 2026,
  "stem": "거주자 갑(복식부기의무자, 제조업)의 2026년도 사업소득 관련 자료이다. 다음 자료에 의한 사업소득금액은 얼마인가? (1) 손익계산서상 당기순이익: 150,000,000원 (2) 손익계산서에는 다음 항목이 포함되어 있다. ① 갑의 급여 60,000,000원(대표자 본인분), ② 갑의 배우자(경리부장 근무, 실제 종사) 급여 40,000,000원, ③ 사업과 관련된 교통사고벌과금 3,000,000원, ④ 거래처 접대비 한도초과액 5,000,000원, ⑤ 회계처리상 수익으로 계상한 예금이자수익 2,000,000원, ⑥ 사업용 유형자산(기계장치) 처분이익 8,000,000원이 영업외수익에 포함됨, ⑦ 본인에 대한 건강보험료(사업주 부담분) 1,200,000원.",
  "choices": [
    "211,000,000원",
    "216,000,000원",
    "208,000,000원",
    "214,200,000원",
    "218,000,000원"
  ],
  "correct_choice": 1,
  "explanation": "사업소득금액 계산(소득세법 제19조, 제27조, 제33조): 당기순이익 150,000,000 + 대표자 본인급여 60,000,000(필요경비 불산입, 소법§33①7) + 벌과금 3,000,000(필요경비 불산입, 소법§33①2) + 접대비 한도초과 5,000,000(필요경비 불산입) - 예금이자수익 2,000,000(이자소득으로 과세, 사업소득에서 제외) = 216,000,000원. 배우자 급여는 실제 종사하면 필요경비 인정(소법§33①6 단서). 기계장치 처분이익은 복식부기의무자라도 사업용 유형자산(토지·건물 제외)의 처분이익은 2020년 이후 사업소득에 포함되므로 그대로 둠(소법§19①20). 대표자 본인 건강보험료(사업주부담분)는 필요경비 인정.",
  "concept_tags": [
    "사업소득금액",
    "필요경비불산입",
    "대표자급여",
    "이자수익조정",
    "복식부기의무자"
  ],
  "expected_seconds": 180,
  "difficulty": "hard",
  "difficulty_score": 4,
  "bloom_level": "apply",
  "rights_status": "synthetic_seed",
  "review_status": "ai_draft_verified",
  "attractor_traps": [
    "211,000,000원: 본인 건강보험료 1,200,000원을 잘못 부인한 경우 (216,000,000 - 추가 계산 오류) 또는 처분이익을 일부 차감",
    "208,000,000원: 기계장치 처분이익 8,000,000원을 사업소득에서 제외한 경우 (216,000,000 - 8,000,000)",
    "214,200,000원: 본인 건강보험료 1,200,000원을 필요경비 불산입으로 가산한 경우 또는 일부 조정 오류",
    "218,000,000원: 배우자 급여를 필요경비 불산입한 경우의 변형 또는 이자수익을 차감하지 않은 경우"
  ],
  "question_id": "cpa1-eval-tax-036"
}