{
  "exam": "CPA_1",
  "subject": "tax",
  "unit": "income_tax",
  "applicable_year": 2026,
  "stem": "거주자 을(복식부기의무자)의 2026년 사업소득 관련 자료이다. 사업소득금액 계산 시 필요경비에 산입할 수 있는 금액의 합계는? (1) 본인에 대한 급여: 50,000,000원 (2) 사업과 관련된 거래처 접대비(증빙 적격): 8,000,000원으로 한도 내 금액임 (3) 가사 관련 경비: 3,000,000원 (4) 사업용 고정자산의 감가상각비(상각범위액 내): 12,000,000원 (5) 본인의 국민건강보험료: 2,400,000원",
  "choices": [
    "20,000,000원",
    "22,400,000원",
    "70,000,000원",
    "72,400,000원"
  ],
  "correct_choice": 1,
  "explanation": "사업소득 필요경비 산입 여부 판정: (1) 사업주 본인 급여는 필요경비 불산입(소득세법 제33조). (2) 적격증빙 접대비 한도 내 금액 8,000,000원은 필요경비 산입. (3) 가사 관련 경비는 필요경비 불산입(제33조 제1항 제5호). (4) 상각범위액 내 감가상각비 12,000,000원은 필요경비 산입. (5) 사업자 본인의 국민건강보험료 2,400,000원은 필요경비 산입(소득세법 시행령 제55조). 합계 = 8,000,000 + 12,000,000 + 2,400,000 = 22,400,000원.",
  "concept_tags": [
    "사업소득",
    "필요경비",
    "접대비한도",
    "가사관련경비",
    "국민건강보험료"
  ],
  "expected_seconds": 140,
  "difficulty": "mid",
  "difficulty_score": 3,
  "bloom_level": "analyze",
  "rights_status": "synthetic_seed",
  "review_status": "ai_draft_verified",
  "attractor_traps": [
    "20,000,000원: 본인 국민건강보험료를 필요경비 불산입으로 오인",
    "70,000,000원: 본인 급여를 필요경비로 산입한 오류",
    "72,400,000원: 본인 급여 포함 + 건강보험료 포함한 오류"
  ],
  "question_id": "cpa1-eval-tax-034"
}